{
  "$schema": "../schema/climate.schema.json",
  "id": "tropical_andes",
  "name": "Tropical Andes",
  "region": "Cordillera Blanca, Cordillera Real, Ecuadorian volcanoes (approximate) and the Bolivian Altiplano.",
  "latitude_deg": -9.1,
  "reference_elevation_m": 5000,
  "reference_site": "Cordillera Blanca high camps (~5000 m)",
  "mean_temp_c": [-1.5, -1.5, -1.5, -1.8, -2.2, -2.8, -3.0, -2.6, -2.2, -1.8, -1.6, -1.6],
  "diurnal_range_c": [7, 7, 7, 9, 11, 12, 12, 12, 11, 9, 8, 7],
  "jet_stream_wind_ms": [7, 7, 8, 11, 15, 18, 19, 18, 15, 12, 9, 8],
  "storms_per_week": [3.5, 3.8, 3.5, 2.0, 0.8, 0.4, 0.3, 0.5, 1.0, 1.8, 2.2, 3.0],
  "precipitation_mm_per_day": [5.0, 5.5, 5.0, 3.0, 1.0, 0.4, 0.3, 0.5, 1.2, 2.5, 3.0, 4.2],
  "lapse_rate_c_per_km": 5.8,
  "prevailing_wind_from_deg": 90,
  "summit_windows": [5, 6, 7, 8],
  "sources": [
    "Kaser, G. & Osmaston, H. (2002) Tropical Glaciers. Cambridge University Press",
    "Georges, C. (2004) 20th-century glacier fluctuations in the tropical Cordillera Blanca, Peru. AAAR 36",
    "Hersbach, H. et al. (2020) The ERA5 global reanalysis. QJRMS 146:1999-2049 (monthly climatology 1991-2020, 300 hPa winds)"
  ],
  "confidence": "medium",
  "notes": "Nearly constant temperature through the year; a pronounced dry season (May-Sep) is the climbing season. Ecuador's equatorial volcanoes have a bimodal regime not captured here."
}
