{
  "$schema": "../schema/climate.schema.json",
  "id": "khumbu",
  "name": "Khumbu Himalaya (Everest region)",
  "region": "Nepal/Tibet Himalaya from Manaslu to Kangchenjunga; also used for Bhutan.",
  "latitude_deg": 27.99,
  "reference_elevation_m": 5364,
  "reference_site": "Everest Base Camp (South)",
  "mean_temp_c": [-14.0, -12.0, -9.0, -5.0, -1.5, 1.0, 1.5, 1.2, -0.5, -5.0, -9.0, -12.0],
  "diurnal_range_c": [12, 12, 11, 10, 8, 6, 5, 5, 6, 9, 11, 12],
  "jet_stream_wind_ms": [48, 50, 45, 35, 22, 15, 10, 10, 15, 25, 35, 45],
  "storms_per_week": [0.6, 0.8, 1.0, 1.0, 1.3, 2.5, 3.0, 3.0, 2.2, 0.9, 0.5, 0.5],
  "precipitation_mm_per_day": [0.3, 0.5, 0.7, 0.8, 1.0, 2.8, 4.0, 3.8, 2.3, 0.8, 0.2, 0.2],
  "lapse_rate_c_per_km": 6,
  "prevailing_wind_from_deg": 270,
  "summit_windows": [5, 10],
  "sources": [
    "Matthews, T. et al. (2020) Going to Extremes: Installing the World's Highest Weather Stations on Mount Everest. BAMS 101(11)",
    "Perry, L. B. et al. (2020) Precipitation characteristics and moisture source regions on Mt. Everest in the Khumbu, Nepal. One Earth 3(5)",
    "Salerno, F. et al. (2015) Weak precipitation, warm winters and springs impact glaciers of south slopes of Mt. Everest. The Cryosphere 9 (Pyramid station 5050 m)",
    "Hersbach, H. et al. (2020) The ERA5 global reanalysis. QJRMS 146:1999-2049 (monthly climatology 1991-2020, 300 hPa winds)"
  ],
  "confidence": "medium",
  "notes": "Monsoon (Jun-Sep) brings most precipitation; winter jet stream over the summit exceeds 45 m/s. Pre-monsoon summit windows open in mid/late May when the subtropical jet migrates north."
}
