{
  "$schema": "../schema/climate.schema.json",
  "id": "pamir_tianshan",
  "name": "Pamir and Tian Shan",
  "region": "Pamir (Lenin, Ismoil Somoni, Korzhenevskaya, Muztagh Ata) and Central Tian Shan (Pobeda, Khan Tengri).",
  "latitude_deg": 40.5,
  "reference_elevation_m": 4200,
  "reference_site": "Lenin Peak Camp 1 / South Inylchek base camps",
  "mean_temp_c": [-20.0, -19.0, -14.0, -9.0, -4.5, -0.5, 2.0, 1.5, -2.5, -8.0, -14.0, -18.0],
  "diurnal_range_c": [10, 10, 11, 11, 11, 11, 11, 11, 11, 11, 10, 10],
  "jet_stream_wind_ms": [40, 42, 40, 35, 30, 26, 24, 24, 26, 32, 37, 40],
  "storms_per_week": [0.8, 1.0, 1.3, 1.5, 1.6, 1.5, 1.3, 1.1, 0.8, 0.8, 0.8, 0.8],
  "precipitation_mm_per_day": [0.8, 1.0, 1.6, 2.0, 2.4, 2.0, 1.6, 1.2, 0.8, 0.8, 0.8, 0.7],
  "lapse_rate_c_per_km": 6.5,
  "prevailing_wind_from_deg": 270,
  "summit_windows": [7, 8],
  "sources": [
    "Aizen, V. B. et al. (1997) Climatic and hydrologic changes in the Tien Shan, Central Asia. Journal of Climate 10",
    "Gorbunov meteorological observatory (Fedchenko Glacier, 4169 m) records",
    "Hersbach, H. et al. (2020) The ERA5 global reanalysis. QJRMS 146:1999-2049 (monthly climatology 1991-2020, 300 hPa winds)"
  ],
  "confidence": "low",
  "notes": "Continental: very cold winters, spring/early-summer precipitation maximum, dry and stable late summer."
}
