{
  "$schema": "../schema/climate.schema.json",
  "id": "central_andes",
  "name": "Central Andes (Aconcagua)",
  "region": "Subtropical Andes of Argentina and Chile; also Ojos del Salado (drier).",
  "latitude_deg": -32.65,
  "reference_elevation_m": 4300,
  "reference_site": "Plaza de Mulas",
  "mean_temp_c": [0.5, 0.0, -2.0, -5.0, -8.5, -11.0, -12.0, -11.0, -9.0, -6.0, -3.0, -0.5],
  "diurnal_range_c": [14, 14, 13, 12, 11, 10, 10, 11, 12, 13, 14, 14],
  "jet_stream_wind_ms": [25, 24, 27, 32, 38, 45, 48, 46, 42, 36, 30, 27],
  "storms_per_week": [0.6, 0.6, 0.7, 0.9, 1.2, 1.5, 1.5, 1.4, 1.2, 1.0, 0.8, 0.6],
  "precipitation_mm_per_day": [0.3, 0.3, 0.4, 0.8, 1.5, 2.2, 2.2, 1.8, 1.2, 0.7, 0.4, 0.3],
  "lapse_rate_c_per_km": 7,
  "prevailing_wind_from_deg": 270,
  "summit_windows": [12, 1, 2],
  "sources": [
    "Garreaud, R. (2009) The Andes climate and weather. Advances in Geosciences 22",
    "Aconcagua Provincial Park weather records (Plaza de Mulas)",
    "Hersbach, H. et al. (2020) The ERA5 global reanalysis. QJRMS 146:1999-2049 (monthly climatology 1991-2020, 300 hPa winds)"
  ],
  "confidence": "medium",
  "notes": "Dry: most precipitation falls as winter snow. Summer 'viento blanco' storms bring hurricane-force winds and spindrift."
}
