{
  "$schema": "../schema/climate.schema.json",
  "id": "alaska_range",
  "name": "Alaska Range (Denali)",
  "region": "Central Alaska Range.",
  "latitude_deg": 63.07,
  "reference_elevation_m": 4328,
  "reference_site": "Denali 14,200 ft Camp (Genet Basin)",
  "mean_temp_c": [-28.0, -28.0, -26.0, -21.0, -15.0, -10.0, -8.0, -9.0, -14.0, -20.0, -25.0, -27.0],
  "diurnal_range_c": [6, 7, 9, 11, 12, 12, 11, 10, 9, 8, 6, 6],
  "jet_stream_wind_ms": [25, 25, 23, 20, 18, 17, 17, 18, 22, 24, 25, 25],
  "storms_per_week": [1.6, 1.5, 1.4, 1.2, 1.0, 1.1, 1.4, 1.6, 1.8, 1.8, 1.7, 1.7],
  "precipitation_mm_per_day": [2.0, 1.8, 1.6, 1.3, 1.2, 1.6, 2.4, 3.0, 3.0, 2.6, 2.2, 2.1],
  "lapse_rate_c_per_km": 6.5,
  "prevailing_wind_from_deg": 230,
  "summit_windows": [5, 6],
  "sources": [
    "National Park Service, Denali mountaineering weather resources",
    "Denali high-altitude weather station at 5715 m / 18,733 ft (Japanese Alpine Club, later University of Alaska IARC and NPS)",
    "Hersbach, H. et al. (2020) The ERA5 global reanalysis. QJRMS 146:1999-2049 (monthly climatology 1991-2020, 300 hPa winds)"
  ],
  "confidence": "low",
  "notes": "Polar air and low barometric pressure (high latitude) make Denali physiologically higher than its altitude; May-June offers long daylight and the most stable weather."
}
