{
  "$schema": "../schema/climate.schema.json",
  "id": "caucasus",
  "name": "Greater Caucasus",
  "region": "Elbrus, Kazbek, Ushba and the central Caucasus.",
  "latitude_deg": 43.35,
  "reference_elevation_m": 4000,
  "reference_site": "Elbrus south slope (Priut 11 / Diesel Hut)",
  "mean_temp_c": [-17.0, -17.0, -14.0, -10.0, -6.0, -2.5, 0.5, 0.5, -3.0, -7.0, -12.0, -15.0],
  "diurnal_range_c": [7, 7, 8, 8, 8, 8, 9, 9, 9, 8, 7, 7],
  "jet_stream_wind_ms": [35, 35, 32, 28, 24, 20, 18, 18, 22, 26, 30, 33],
  "storms_per_week": [1.3, 1.3, 1.5, 1.6, 1.8, 1.9, 1.6, 1.4, 1.2, 1.2, 1.3, 1.3],
  "precipitation_mm_per_day": [2.5, 2.5, 3.0, 3.5, 4.5, 5.0, 4.0, 3.5, 3.0, 2.8, 2.8, 2.6],
  "lapse_rate_c_per_km": 6,
  "prevailing_wind_from_deg": 260,
  "summit_windows": [7, 8],
  "sources": [
    "Terskol (2141 m) station climatology, Roshydromet",
    "Shahgedanova, M. et al. (2014) Changes in the mountain river discharge in the northern Caucasus. Global and Planetary Change 118",
    "Hersbach, H. et al. (2020) The ERA5 global reanalysis. QJRMS 146:1999-2049 (monthly climatology 1991-2020, 300 hPa winds)"
  ],
  "confidence": "medium",
  "notes": "Early summer is stormiest; August is the most reliable month. Whiteout on the Elbrus plateau is the dominant hazard."
}
