{
  "$schema": "../schema/climate.schema.json",
  "id": "saint_elias",
  "name": "Saint Elias Mountains",
  "region": "Mount Logan and Mount Saint Elias; maritime, heavily glaciated.",
  "latitude_deg": 60.5,
  "reference_elevation_m": 3000,
  "reference_site": "King Trench (Mount Logan) camps",
  "mean_temp_c": [-22.0, -21.0, -19.0, -14.0, -9.0, -4.5, -2.5, -3.5, -7.5, -13.0, -18.0, -21.0],
  "diurnal_range_c": [5, 6, 7, 8, 9, 9, 8, 8, 7, 6, 5, 5],
  "jet_stream_wind_ms": [28, 27, 25, 22, 19, 18, 18, 19, 23, 26, 28, 28],
  "storms_per_week": [2.0, 1.8, 1.6, 1.3, 1.1, 1.2, 1.4, 1.8, 2.2, 2.3, 2.2, 2.1],
  "precipitation_mm_per_day": [6.0, 5.0, 4.5, 3.5, 3.0, 3.0, 3.5, 5.0, 7.0, 8.0, 7.0, 6.5],
  "lapse_rate_c_per_km": 6.5,
  "prevailing_wind_from_deg": 210,
  "summit_windows": [5, 6],
  "sources": [
    "Parks Canada, Kluane National Park mountaineering information",
    "Hersbach, H. et al. (2020) The ERA5 global reanalysis. QJRMS 146:1999-2049 (monthly climatology 1991-2020, 300 hPa winds)"
  ],
  "confidence": "low",
  "notes": "Storms from the Gulf of Alaska; long waits for flights onto the Seward/Quintino Sella glaciers."
}
